Property,Datatype,Description
File name,String,"A file name or full path referencing a data file produced by the related process that MAY be packaged with, or is accessible via, the ISA reference implementation content."
Pointer,String,"A pointer referencing a location inside the data file. This SHOULD always be specified when the data of interest is not the complete file, but a specific part of it."
Generated By,String,"A file name, full path or identifier referencing the tool with which this data object was generated."
Attribute,Ontology Annotation,An ontology annotation qualifying what the data describes.
Unit,Ontology Annotation,The unit qualifying the value stored in the data object.
Object Type,String,Specifies the data type in which the value in the data object will be stored.
